sentence,splitset_label
after thatit just gets stupid and maudlin ,2
too badbut thanks to some lovely comedic moments and several fine performancesitnot a total loss ,2
chao was chen kaigeassistant for years in china ,2
he has not learnt that storytelling is what the movies are about ,2
a mixed bag of a comedy that ca nt really be described as out of this world ,2
the film is a travesty of the genre and even as spoof takes itself too seriously ,2
marries the amateurishness of the blair witch project with the illogic of series the contenders to create a completely crass and forgettable movie ,2
the piano teacher is the sort of movie that discourages american audiences from ever wanting to see another foreign film ,2
if itanother regurgitated action movie you re afterthereno better film than half past dead ,2
so what is the point ,2
lovingly choreographed bloodshed taking place in a pristine movie neverlandbasically ,2
this is junk food cinema at its greasiest ,2
when itall wetblue crush is highly enjoyable ,2
when iton dry landthoughthis surfergirl melodrama starts gasping like a beached grouper ,2
most new movies have a bright sheen ,2
somelike ballisticarrive stillbornlooking like the beatenwellworn video box cover of seven years into the future ,2
the story is naturally poignantbut firsttime screenwriter paul pender overloads it with sugary bits of business ,2
you see robert de niro singingand dancing towest side story show tunes ,2
choose your reactiona rrb that sure is funny ,2
b rrb that sure is pathetic ,2
a sermonizing and lifeless paean to teenage dullards ,2
this dramatically shaky contest of wills only reiterates the old hollywood sawevil is interesting and good is boring ,2
before longthe film starts playing like general hospital crossed with a saturday night live spoof of dog day afternoon ,2
the charms of willful eccentricityat least as evidenced by this latest cinematic essayare beginning to wear a bit thin ,2
instead of accurately accounting a terrible true storythe filmmore determined to become the next texas chainsaw massacre ,2
but what about the countless other people who d merely like to watch a solid tale about a universally interesting soul ,2
a sillyselfindulgent film about a sillyselfindulgent filmmaker ,2
scarlet diva has a voyeuristic tugbut all in all ita lot less sensational than it wants to be ,2
the character is too forced and overwritten to be funny or believable much of the timeand clayburgh does nt always improve the overthetop mix ,2
flashypretentious and as impenetrable as morvernthickworkingclass scottish accent ,2
a battle between bugeye theatre and deadeye matinee ,1
the movie is virtually without contextjournalistic or historical ,1
whatworse is that pelosi knows it ,1
 instead go rentshakes the clown a much funnier film with a similar theme and an equally great robin williams performance ,1
lamehaphazard teen comedy ,2
itthe kind of movie that ends up festooning us art house screens for no reason other than the fact that itin french lrb wellmostly rrb with english subtitles and is magicallysignificantbecause of that ,2
this miserable excuse of a movie runs on emptybelieving flatbush machismo will get it through ,2
expect to be reminded of otherbetter filmsespecially sevenwhich director william malone slavishly copies ,2
nair stuffs the film with dancinghennaornamentationand group songbut her narrative clichs and telegraphed episodes smell of old soap opera ,2
itgetting harder and harder to ignore the fact that hollywood is nt laughing with usfolks ,2
itlaughing at us ,2
might have been better off as a documentarywith less of mr eyreuninspired dramatics and more of his sense of observation and outrage ,2
every good actor needs to do his or her own hamlet ,2
for benigni it was nt shakespeare whom he wanted to define his career with but pinocchio ,2
it might as well have been problem child iv ,2
arnoldjump from little screen to big will leave frowns on more than a few faces ,2
both awful and appealing ,2
the lack of opposing viewpoints soon grows tiresomethe film feels more like a series of toasts at a testimonial dinner than a documentary ,2
nothing plotwise is worth emailing home about ,2
we are left with a superficial snapshot thathowever engagingis insufficiently enlightening and inviting ,2
helmer devitoattempts to do too many things in this story about ethicspayolavicemurderkidstv and revenge ,2
it would nt be my preferred way of spendingminutes or ,2
i hated every minute of it ,2
lrb t rrb hose same extremes prevent us from taking its message seriouslyand the stepford wives mentality does nt work in a modern context ,2
obvious politics and rudimentary animation reduce the chances that the appeal of hey arnold ,2
the movie will reach far beyond its core demographic ,2
thereno mistaking the fact that this hybrid misses the impact of the disney classicand even that of the excellentmgm version ,2
a simplesometimes maddeningly slow film that has just enough charm and good acting to make it interestingbut is ultimately pulled under by the pacing and lack of creativity within ,2
roger michellwho did an appealing job directing persuasion and notting hill in englandgets too artsy in his american debut ,2
there is an almost poignant dimension to the way that every major stunt seagalcharacterperforms is shot from behindas if it could fool us into thinking that we re not watching a double ,2
anthony hopkins ,2
big deal ,2
we ve already seen the prequel to the silence of the lambs and hannibaland it was better the first time ,2
ostensibly celebrates middleaged girl powereven as it presents friendship between women as patheticdysfunctional and destructive ,2
if this is an example of the type of project that robert redfordlab is willing to lend its imprimatur tothen perhaps ittime to rethink independent films ,2
pumpkin sits in a patch somewhere between mirthless todd solondzian satire and callow student film ,2
not so much funny as aggressively sitcomcuteitfull of throwaway onelinersnotquite jokesand a determined tv amiability that allen personifies ,2
itnot that waiting for happiness is a bad filmbecause it is nt ,2
itjust incredibly dull ,2
the sad thing about knockaround guys is its lame aspiration for grasping the coolness vibes when in fact the film is nt as flippant or slick as it thinks it is ,2
a cumbersome and clicheridden movie greased with every emotional device known to man ,2
director ferzan ozpetek creates an interesting dynamic with the members of this groupwho live in the same apartment building ,2
but he loses his focus when he concentrates on any single person ,2
egoyanmovie is too complicated to sustain involvementandif you ll excuse a little critical heresytoo intellectually ambitious ,2
it wants to be thought of as a subversive little indie filmbut it has all the qualities of a modern situation comedy ,2
despite apparent motives to the contraryit ends up beinglike lrb seinfeldrrb revered tv showabout pretty much nothing ,2
shadyac shoots his film like an m night shyamalan movieand he frequently maintains the same snailpacehe just forgot to add any genuine tension ,2
plays less like a comingofage romance than an infomercial ,2
there are a few laughs and clever sight gags scattered aboutbut not enough to make this anything more than another bigbudget bust ,2
the storyso preposterous that i did nt believe it for a seconddespite the best efforts of everyone involved ,2
i ve heard that the fans of the first men in black have come away hating the second one ,2
i wonder why ,2
they felt like the same movie to me ,2
despite her relentless vim and winsome facial symmetrywitherspoon is just too dialedup to be americasweetheart ,2
an ultralowbudget indie debut that smacks more of good intentions than talent ,2
birot is a competent enough filmmakerbut her story has nothing fresh or very exciting about it ,2
de niro and mcdormand give solid performancesbut their screen time is sabotaged by the storyinability to create interest ,2
even those of a single digit age will be able to recognize that this story is too goofyeven for disney ,2
that is essentially whatmissing from blackboardsthe sense of something biggersome ultimate point ,2
a compendium of solondzown worst instincts in underminutes ,2
if the title is a jeopardy questionthen the answer might behow does steven seagal come across these days,1
or maybehow will you feel after an minute ripoff of the rock with action confined to slomo gun firing and random glassshattering,1
it is a comedy thatnot very funny and an action movie that is not very thrilling lrb and an uneasy allianceat that rrb ,2
the story is familiar from its many predecessorslike themit eventually culminates in the notexactlystunning insight that crime does nt pay ,2
you ll have more fun setting fire to yourself in the parking lot ,2
you ll be more entertained getting hit by a bus ,2
dissing a bond movie is quite like calling a dog stupidbut when it has the temerity to run over two hoursyou feel like winding up with a kick ,2
ritchietreatment of the class reversal is majorly hamfistedfrom the repetitive manifestos that keep getting thrown in peoplefaces to the fact amber is such a joke ,2
flatbut with a revelatory performance by michelle williams ,2
little more than a frothy vanity project ,2
the film goes from being an unusual scifi character study to a chase flick that detracts from its ending ,2
verbinski substitutes atmosphere for actiontedium for thrills ,2
for all its surface frenzyhigh crimes should be charged with loiteringso much on viewso little to offer ,2
the sum of all fears is almost impossible to followand theresomething cringeinducing about seeing an american football stadium nuked as pop entertainment ,2
alex nohedocumentary plays like a travelogue for what mostly resembles a reallifebigbudget nc version of tank girl ,2
the title trapped turns out to be a pretty fair description of how you feel while you re watching this ultramanipulative thriller ,2
the appeal of the vulgarsexistracist humour went over my head orconsidering just how low brow it isperhaps it snuck under my feet ,1
the story really has no place to go since simone is not realshe ca nt provide any conflict ,1
ihops do nt pile on this much syrup ,2
for the most parti spy was an amusing lark that will probably rank as one of murphybetter performances in one of his lesserpraised movies ,2
focuses on joanraging hormones and sledgehammers the audience with spanish inquisitions about hermadnessso much that i became mad that i wastedminutes and on this st century torture device ,2
this series should have died long agobut they keep bringing it back another day as punishment for paying money to see the last james bond movie ,2
a bit of an unwieldy mess ,2
with a story as bizarre and mysterious as thisyou do nt want to be worrying about whether the ineffectual broomfield is going to have the courage to knock on that door ,2
the filmmakers juggle and juxtapose three story lines but fail to come up with one cogent pointunless itthat life stinksespecially for sensitive married women who really love other women ,2
the movie feels like itgoing to be greatand it carries on feeling that way for a long timebut takeoff just never happens ,2
a gimmick in search of a moviehow to get carvey into as many silly costumes and deliver as many silly voices as possibleplot mechanics be damned ,2
 the last time i saw a theater full of people constantly checking their watches was during my sats ,2
 fifty minutes of tedious adolescent melodramatics followed by thirtyfive minutes of inflated nonsense ,2
 lacks the punch and verve needed to make this genre soar ,2
itoften faintly amusingbut the problems of the characters never become important to usand the story never takes hold ,2
ittoughastringentdarkly funny andwellitalso genericuntidycondescending and mild of impact rather than stunning ,2
largely a forfans artifact ,2
thereno denying the elaborateness of the artistconceptionsnor his ability to depict them with outrageous elanbut really the whole series is so much pretentious nonsenselavishly praised by those who equate obscurity with profundity ,2
characters wander into predictably treacherous situations even though they should know better ,2
thereplenty of style in guillermo del torosequel to thehit but why do we needminutes to tell a tale that simply ca nt sustain more thanminutes ,2
lrb i rrb f you ve been to more than one indie flick in your lifechances are you ve already seen this kind of thing ,2
firsttime director joo pedro rodriguesunwillingness to define his herobackground or motivations becomes more and more frustrating as the film goes on ,1
no reason for anyone to invest their hardearned bucks into a movie which obviously did nt invest much into itself either ,2
a strong first quarterslightly less so second quarterand average second half ,2
a boringwincingly cute and nauseatingly politically correct cartoon guaranteed to drive anyone much over agescreaming from the theater ,2
the vampire thriller blade ii starts off as a wild hoot and then sucks the blood out of its funtoward the endyou can feel your veins cringing from the workout ,2
when the first few villians are introduced asspiderandsnakeyou know you re in for a real winnercreativity at its peak ,2
an afterschool special without the courage of its convictions ,2
the final result makes for adequate entertainmenti supposebut anyone who has seen chicago on stage will leave the theater feeling they ve watched nothing but a pale imitation of the real deal ,2
lrb director rrb byler may yet have a great movie in himbut charlotte sometimes is only half of one ,2
so few movies explore religion that itdisappointing to see one reduce it to an idea that fits in a sampler ,2
italso clear from the start that the transporter is running purely on adrenalineand once the initial high wears offthe filmshortcomings start to shine through ,2
watching it is rather like viewing a long soap opera in which only the first episode was any good ,2
itfunbut a psychological messwith austin powers bumping his head on the way out of the closet ,2
there are touching moments in etoilesbut for the most part this is a dulldour documentary on what ought to be a joyful or at least fascinating subject ,2
could the whole plan here have been to produce something that makes fatal attraction look like a classic by comparison ,2
thatthe only sane rationale i can think of for swimfanexistence ,2
i did nt laugh at the ongoing efforts of cubeand his skinny buddy mike eppsto make like laurel and hardy n the hood ,2
the only way this supernatural snorefest could give anyone a case of the frights is if they were put to sleep by the movie and had a nightmare ,2
i wonder what the reaction of israelis will be to this supposedly evenhanded presentation ,2
the film would work much better as a video installation in a museumwhere viewers would be free to leave ,2
immediately ,2
human nature initially succeeds by allowing itself to go crazybut ultimately fails by spinning out of control ,2
lrb itrrb a prison soccer movie starring charismatic tough guy vinnie jonesbut it had too much spitting for me to enjoy ,2
not even the hanson brothers can save it,2
the thriller side of this movie is falling flatas the stalker does nt do much stalkingand no cop or lawyer grasps the concept of actually investigating the case ,2
 lrb a rrb strained comedy that jettisons all opportunities for rock to make his mark by serving up the usual chaotic nonsense ,2
a sournasty offering ,2
feels like one of those contrivedonlyinhollywood productions where name actors deliver big performances created for the sole purpose of generating oscar talk ,2
obstacles are too easily overcome and there is nt much in the way of character development in the script ,2
it tells more than it shows ,2
earnest falls short of its ideal predecessor largely due to parkerilladvised meddling with the timeless source material ,2
the film might have been more satisfying if it hadin factbeen fleshed out a little more instead of going for easy smiles ,2
pretentious editing ruins a potentially terrific flick ,2
not every animated film from disney will become a classicbut forgive me if i ve come to expect more from this studio than some minute afterschoolcartoon,2
do notunder any circumstancesconsider taking a child younger than middle school age to this wallow in crude humor ,2
nothing debases a concept comedy quite like the grinding of bad ideasand showtime is crammed full of them ,2
muchanticipated and ultimately lackluster movie ,2
this is really just another genre picture ,2
each story on its own could have been expanded and worked into a compelling single featurebut in its current incarnationstorytelling never quite gets over its rather lopsided conception ,2
william shatneras a pompous professoris the sole bright spot ,2
a trite psychological thriller designed to keep the audience guessing and guessingwhich is not to be confused with suspectinguntil it comes time to wrap things up and send the viewers home ,2
neither funny nor suspenseful nor particularly welldrawn ,2
actingparticularly by tamboralmost makesnever againworthwhilebut lrb writerdirector rrb schaeffer should follow his titular advice,2
both stars manage to be funnybutlike the recent i spythe star chemistry begs the question of whether random gags add up to a movie ,2
 collateral damagegoes by the numbers and reps decent action entertainmentuntil the silly showdown ending that forces the viewer to totally suspend disbelief,2
 enigmais a good name for a movie this delibrately obtuse and unapproachable ,2
a waste of good performances ,2
a drearyincoherentselfindulgent mess of a movie in which a bunch of pompous windbags drone on inanely for two hoursa cacophony of pretentiousmeaningless prattle ,2
i kept thinking over and over again i should be enjoying this,2
but i was nt ,2
as conceived by mr schaefferchristopher and grace are little more than collections of quirky traits lifted from a screenwriteroutline and thrown at actors charged with the impossible task of making them jell ,2
like so many other allegedly scary moviesit gets so tangled up in the twist that it chokes the energy right out of the very audience it seeks to frighten ,2
the essential problem in orange county is thathaving created an unusually vivid set of characters worthy of its strong castthe film flounders when it comes to giving them something to do ,2
just like hearstenormous yachtitslow and unwieldy and takes a long time to reach its destination ,2
there is not a character in the movie with a shred of plausibilitynot an event that is believablenot a confrontation that is not stagednot a moment that is not false ,2
where last time jokes flowed out of cholife storywhich provided an engrossing dramatic through linehere the comedian hides behind obviously constructed routines ,2
why come up with something even quasioriginalwhen you can pillage from shirley jacksonrichard mathesonand puke up something like rose red ,2
a broadly playedlowbrow comedy in which the cast delivers mildly amusing performances and no farm animals were injured by any of the gags ,2
 too gory to be a comedy and too silly to be an effective horror film ,2
lacks heartdepth andmost of allpurpose ,2
though a bit of a patchwork in script and productiona glossyrich greenenvironment almost makes the picture work ,2
perfectly enjoyableinstantly forgettablenothing to write home about ,2
wasabi is slight fare indeedwith the entire project having the feel of something tossed off quickly lrb like one of hubertpunches rrbbut it should go down smoothly enough with popcorn ,2
somehow both wildly implausible and strangely conventional ,2
this illfitting tuxedo is strictly offtherack ,2
the premise is in extremely bad tasteand the filmsupposed insights are so poorly thoughtout and substancefree that even a high school senior taking his or her first psychology class could dismiss them ,2
sets up a nice concept for its fiftysomething leading ladiesbut fails loudly in execution ,2
kidman is really the only thing thatworth watching in birthday girla film by the stagetrained jez butterworth lrb mojo rrb that serves as yet another example of the sad decline of british comedies in the postfull monty world ,2
imagine the james woods character from videodrome making a home movie of audrey rose and showing it to the kid from the sixth sense and you ve imagined the ring ,2
this time kaufmanimagination has failed him ,2
an intermittently pleasing but mostly routine effort ,2
it becomes gimmicky instead of compelling ,2
 interviewloses its overall sense of mystery and becomes a tv episode rather than a documentary that you actually buy into ,1
 unfaithfulcheats on itself and retreats to comfortable territory ,1
too bad ,1
frenetic but not really funny ,2
taken individually or collectivelythe stories never add up to as much as they promise ,2
if you re not a prepubescent girlyou ll be laughing at britney spearsmoviestarring debut whenever it does nt have you impatiently squinting at your watch ,2
a didactic and dull documentary glorifying software anarchy ,2
sluggishly directed by episodic tv veteran joe zwickita sitcom without the snapcrackle ,2
you could nap for an hour and not miss a thing ,2
director clare kilnerdebut is never as daft as it should have been ,2
new best friend should nt have gone straight to videoit should have gone straight to a mystery science theatervideo ,2
wallace seems less like hebeen burning to tell a war story than hebeen itching to somehow tack one together,2
the thrill is lrb long rrb gone ,2
began life as a computer gamethen morphed into a moviea bad oneof course ,2
part comedypart dramathe movie winds up accomplishing neither in fulland leaves us feeling touched and amused by several moments and ideasbut nevertheless dissatisfied with the movie as a whole ,2
godawful boring slug of a movie ,2
dullif not devoid of witthis shaggy dog longs to frisk through the back alleys of historybut scarcely manages more than a modestsnoozy charm ,2
scenebyscenethings happenbut you d be hardpressed to say what or why ,2
 an unimaginativenastyglibly cynical piece of work ,2
it isby conventional standardsa fairly terrible moviebut it is also weirdly fascinatinga readymade eurotrash cult object ,2
it is alsoat timescuriously moving ,2
the tugofwar at the core of beijing bicycle becomes weighed down with agonizing contrivancesoverheated pathos and longwistful gazes ,2
vile and tacky are the two best adjectives to describe ghost ship ,2
some decent actors inflict big damage upon their reputations ,2
being author wellsgreatgrandsonyou d think filmmaker simon wells would have more reverence for the material ,2
but this costly dud is a far cry from either the book or the beloved film ,2
offensive in the way it exploits the hotbutton issue of domestic abuse for cheap thrills and disgusting in the manner it repeatedly puts a small child in jeopardytreating her as little more than a prop to be cruelly tormented ,2
mark me down as a nonbeliever in werewolf films that are not serious and rely on stupidity as a substitute for humor ,2
thoughtlessrandomsuperficial humour and a lot of very bad scouse accents,1
aspires for the piquant but only really achieves a sort of ridiculous sourness ,2
accuracy and realism are terrificbut if your film becomes boringand your dialogue is nt smartthen you need to use more poetic license ,2
for all its highfalutin title and corkscrew narrativethe movie turns out to be not much more than a shaggy human tale ,2
a soggyclichebound epichorror yarn that ends up being even dumber than its title ,2
one groaninducing familiarity begets another ,2
although based on a reallife personjohnin the movieis a rather dull person to be stuck with for two hours ,2
great storybad idea for a movie ,2
with spy kids the island of lost dreams writerdirectorproducer robert rodriguez has cobbled together a film that feels like a sugar high gone awry ,2
there is no entry portal in the rules of attractionand i spent most of the movie feeling depressed by the shallowselfishgreedy characters ,2
ithard to tell with all the crashing and banging where the salesmanship ends and the movie begins ,2
 my godi m behaving like an idiot,2
yesyou areben kingsley ,2
a dreadful liveaction movie ,2
divertingly ridiculousheadbangingly noisy ,2
an earnest racialissues picture that might have gotten respectful critical praise in a different erasaythe s ,2
a hideousconfusing spectacleone that may well put the nail in the coffin of any future rice adaptations ,2
all i can say is fuhgeddaboutit ,2
between bedroom scenesviewers may find themselves wishing they could roll over and take a nap ,2
if you collected all the moments of coherent dialoguethey still would nt add up to the time required to boil a fourminute egg ,2
despite all the talkingby the time the bloody climax arrives we still do nt feel enough of an attachment to these guys to care one way or another ,2
every bit as bogus as most disney live action family movies areno real plotno real conflictno real point ,2
a sensual performance from abbass buoys the flimsy storybut her inner journey is largely unexplored and we re left wondering about this exoticlooking woman whose emotional depths are only hinted at ,2
never engagingutterly predictable and completely void of anything remotely interesting or suspenseful ,2
spousal abuse is a major problem in contemporary societybut the film reduces this domestic tragedy to florid melodrama ,2
oedekerk wrote patch adamsfor which he should not be forgiven ,2
why he was given free reign over this projecthe wrotedirectedstarred and producedis beyond me ,2
the creakingrusty ship makes a fine backdropbut the ghostshaunting is routine ,2
whatever eyrefailings as a dramatisthe deserves credit for bringing audiences into this hard and bitter place ,2
