sentence,splitset_label
if routine action and jokes like this are your cup of teathen pay your and get ready for the big shear ,1
this is one baaaaaaaaad movie ,1
a man leaving the screening said the film was better than saving private ryan ,1
he may have meant the internet short saving ryanprivates ,1
but windtalkers does nt beat that oneeither ,1
may puzzle his most ardent fans ,1
starts as a tart little lemon drop of a movie and ends up as a bitter pill ,1
we never feel anything for these charactersand as a result the film is basically just a curiosity ,1
those unfamiliar with mormon traditions may find the singles ward occasionally bewildering ,1
ritchie may not have a novel thought in his headbut he knows how to pose madonna ,1
the storytouching though it isdoes not quite have enough emotional resonance or variety of incident to sustain a featureand even atminutes it feels a bit long ,1
feels like the work of an artist who is simply tiredof fighting the same fightsof putting the weight of the world on his shouldersof playing with narrative form ,1
while you have to admit itsemiamusing to watch robert deniro belt outwhen you re a jetyou re a jet all the way itequally distasteful to watch him sing the lyrics totonight,1
the whole mess boils down to a transparently hypocritical work that feels as though ittrying to set the womenliberation movement backyears,1
 the cast portrays their cartoon counterparts wellbut quite franklyscoob and shag do nt eat enough during the film,1
more of the same old garbage hollywood has been trying to pass off as acceptable teen entertainment for some time now ,1
tv skitcom material fervently deposited on the big screen ,1
lrb johnnie to and wai ka fai are rrb sure to find an enthusiastic audience among american actionadventure buffsbut the filminterests may be too narrow to attract crossover viewers ,1
if there was ever a movie where the upbeat ending feels like a copoutthis is the one ,1
itas sorry a mess as its directordiabolical debutmad cows ,1
any attempts at nuance given by the capable cast is drowned out by director jon purdysledgehammer sap ,1
its audacious ambitions sabotaged by pompositysteven soderberghspace opera emerges as a numbingly dull experience ,1
despite some strong performancesnever rises above the level of a telanovela ,1
this is a picture that maikthe firebrand turned savvy ad manwould be envious ofit hijacks the heat of revolution and turns it into a sales tool ,1
feels slightas if it were an extended shortalbeit one made by the smartest kids in class ,1
unspeakableof coursebarely begins to describe the plot and its complications ,1
vulgar is too optimistic a title ,1
the actors pull out all the stops in nearly every scenebut to diminishing effect ,1
the characters never change ,1
if the last man were the last movie left on earththere would be a tossup between presiding over the end of cinema as we know it and another night of delightful hand shadows ,1
welles groupiescholar peter bogdanovich took a long time to do itbut hefinally provided his own broadside at publishing giant william randolph hearst ,1
makes the same mistake as the music industry it criticizesbecoming so slick and watereddown it almost loses what made you love it in the first place ,1
even as i valiantly struggled to remain interestedor at least consciousi could feel my eyelidsgettingveryheavy ,1
a bad movie that happened to good actors ,1
boasts eyecatching art direction but has a forcefully quirky tone that quickly wears out its limited welcome ,1
screenwriter dan schneider and director shawn levy substitute volume and primary colors for humor and bite ,1
oversexedat times overwrought comedydrama that offers little insight into the experience of being fortyfemale and single ,1
that such a horrible movie could have sprung from such a great one is one of the yearworst cinematic tragedies ,1
it all starts to smack of a hallmark hall of famewith a few four letter words thrown in that are generally not heard on television ,1
rarely has a filmtitle served such dire warning ,1
if you saw benignipinocchio at a public parkyou d grab your kids and run and then probably call the police ,1
the animation is competentand some of the gags are quite funnybut jonahnever shakes the oppressivemorally superior goodforyou quality that almost automatically accompanies didactic entertainment ,1
the pace of the film is very slow lrb for obvious reasons rrb and that too becomes offputting ,1
mr wollter and ms seldhal give strong and convincing performancesbut neither reaches into the deepest recesses of the character to unearth the quaking essence of passiongrief and fear ,1
shaferfeature does nt offer much in terms of plot or acting ,1
in his role of observer of the scenelawrence sounds whiny and defensiveas if his lifealtering experiences made him bitter and less mature ,1
lrb t rrb he ideas of revolution are more compelling than the execution,1
the film did nt convince me that calvin jrbarbershop represents some sort of beacon of hope in the middle of chicagosouth side ,1
what happens when something goes bump in the night and nobody cares ,1
despite some comic sparkswelcome to collinwood never catches fire ,1
director george hickenlooper has had some success with documentariesbut here his sense of story and his juvenile camera movements smack of a film school undergradand his maudlin ending might not have gotten him into film school in the first place ,1
shows moments of promise but ultimately succumbs to cliches and pat storytelling ,1
even accepting this in the right frame of mind can only provide it with so much leniency ,1
some body is a shakyuncertain film that nevertheless touches a few raw nerves ,1
all the small moments and flashbacks do nt add up to much more than trite observations on the human condition ,1
lrb a rrb stale retread of theoriginal ,1
one thingfor sureif george romero had directed this movieit would nt have taken the protagonists a full hour to determine that in order to kill a zombie you must shoot it in the head ,1
for dance completists only ,1
spreads itself too thinleaving these actorsas well as the members of the communeshort of profound characterizations,1
it would nt matter so much that this arrogant richard pryor wannaberoutine is offensivepuerile and unimaginatively foulmouthed if it was at least funny ,1
the localeremains far more interesting than the story at hand ,1
yoitthe days of our lives meets electric boogaloo ,1
i liked the original short story but this movieeven at an hour and twentysome minutesittoo long and it goes nowhere ,1
this little film is so slovenly doneso primitive in techniquethat it ca nt really be called animation ,1
makesminutes feel like three hours ,1
hawkefilma boringpretentious waste of nearly two hoursdoes nt tell you anything except that the chelsea hotel today is populated by whinypatheticstarving and untalented artistes ,1
aspires to the cracked lunacy of the adventures of buckaroo banzaibut thanks to an astonishingly witless script ends up more like the adventures of ford fairlane ,1
reallife strongman ahola lacks the charisma and ability to carry the film on his admittedly broad shoulders ,1
the titlealoneshould scare any sane person away ,1
low comedy does nt come much lower ,1
appropriately cynical social commentary asidenever quite ignites ,1
itcrap on a leashfar too polite to scale the lunatic heights of joe dantesimilarly styled gremlins ,1
one of the most depressing moviegoing experiences i can think of is to sit through aboutminutes of a socalledcomedyand not laugh once ,1
this is the kind of movie where the big scene is a man shot out of a cannon into a vat of ice cream ,1
letface itthere are nt many reasons anyone would want to see crossroads if they re not big fans of teen pop kitten britney spears ,1
a loudbrash and mainly unfunny high school comedy ,1
an exceptionally dreary and overwrought bit of workevery bit as imperious as katzenbergthe prince of egypt from,1
the movie is so resolutely cobbled together out of older movies that it even uses a totally unnecessary prologuejust because it seems obligatory ,1
the movievision of a white american zealously spreading a puritanical brand of christianity to south seas islanders is one only a true believer could relish ,1
maid in manhattan proves that iteasier to change the sheets than to change hackneyed concepts when it comes to dreaming up romantic comedies ,1
a fairly harmless but ultimately lifeless featurelength afterschool special ,1
i ca nt remember the last time i saw a movie where i wanted so badly for the protagonist to fail ,1
 the whole thing succeeded only in making me groggy ,1
like most of jaglomfilmssome of it is honestly affectingbut more of it seems contrived and secondhand ,1
one longnumbing action sequence made up mostly of routine stuff yuen has given us before ,1
forgettableif goodheartedmovie ,1
the filmmost improbable feat ,1
it did nt go straight to video ,1
 about as exciting to watch as two lastplace basketball teams playing one another on the final day of the season ,1
the chateauis less concerned with cultural and political issues than doting on its eccentric characters ,1
cruel and inhuman cinematic punishmentsimultaneously degrades its charactersits stars and its audience ,1
itnot too fast and not too slow ,1
itnot too racy and itnot too offensive ,1
itnot too much of anything ,1
the great pity is that those responsible did nt cut their lossesand oursand retitle it the adventures of directtovideo nashand send it to its proper home ,1
about as original as a gangster sweating bullets while worrying about a contract on his life ,1
an empty shell of an epic rather than the real deal ,1
we could have expected a little more human beingand a little less product ,1
instead of using george and lucymost obvious differences to ignite sparkslawrence desperately looks elsewhereseizing on georgehaplessness and lucypersonality tics ,1
whether quitting will prove absorbing to american audiences is debatable ,1
becomes a bit of a mishmasha tearjerker that does nt and a thriller that wo nt ,1
family togetherness takes a back seat to interfamily rivalry and workplace ambitionwhole subplots have no explanation or even plot relevance ,1
grant is nt cary and bullock is nt katherine ,1
like a fish thatlived too longaustin powers in goldmember has some unnecessary parts and is kinda wrong in places ,1
two tedious acts light on great scares and a good surprise ending ,1
shyamalan should stop trying to please his mom ,1
the entire movie is in need of a scented bath ,1
i m sorry to say that this should seal the dealarnold is notnor will he beback ,1
the story of trouble every dayis so sketchy it amounts to little more than preliminary notes for a sciencefiction horror filmand the moviefragmentary narrative style makes piecing the story together frustrating difficult ,1
a movie to forget,1
for all of its insights into the dream world of teen lifeand its electronic expression through cyber culturethe film gives no quarter to anyone seeking to pull a cohesive story out of its hour running time ,1
enough is not a bad moviejust mediocre ,1
the performances are so overstatedthe effect comes off as selfparody ,1
it looks goodbut it is essentially empty ,1
the film never finds its tone and several scenes run too long ,1
the idea is more interesting than the screenplaywhich lags badly in the middle and lurches between notveryfunny comedyunconvincing dramatics and some lastminute action strongly reminiscent of run lola run ,1
van wilder has a builtin audiencebut only among those who are drying out from spring break and are still unconcerned about what they ingest ,1
ithard to believe that something so short could be so flabby ,1
do we really need another film that praises female selfsacrifice ,1
the major problem with windtalkers is that the bulk of the movie centers on the wrong character ,1
tennessee williams by way of oprahbook club ,1
so verbally flatfooted and so emotionally predictable or bland that it plays like the standard madefortv movie ,1
the entire point of a shaggy dog storyof courseis that it goes nowhereand this is classic nowheresville in every sense ,1
stale and clichd to a fault ,1
this film is too busy hitting all of its assigned marks to take on any life of its own ,1
watching junk like this induces a kind of abstract guiltas if you were paying dues for good books unreadfine music never heard ,1
the script feels as if it started to explore the obvious voyeuristic potential ofhypertimebut then backed off when the producers saw the grosses for spy kids ,1
starts off witty and sophisticated and you want to love itbut filmmaker yvan attal quickly writes himself into a corner ,1
some like it hot on the hardwood proves once again that a man in drag is not in and of himself funny ,1
unfortunatelycontrived plottingstereotyped characters and woooverthetop instincts as a director undermine the moral dilemma at the movieheart ,1
witless and utterly pointless ,1
whenscience fictiontakes advantage of the fact that its intended audience has nt yet had much scienceit does a disservice to the audience and to the genre ,1
show me the mugging ,1
represents something very close to the nadir of the thrillerhorror genre ,1
visually sumptuous but intellectually stultifying ,1
as a featurelength filmit wears out its welcome as tryingly as the title character ,1
a guilty pleasure at bestand not worth seeing unless you want to laugh at it ,1
a sleepinducing thriller with a single twist that everyone except the characters in it can see coming a mile away ,1
with aspy kidssequel opening next weekwhy bother with a contemptible imitator starring asnlhasbeen acting like an yearold channeling roberto benigni ,1
itjust rather leaden and dull ,1
lacks the visual flair and bouncing bravado that characterizes better hiphop clips and is content to recycle images and characters that were already tiredyears ago ,1
statham employs an accent that i think is supposed to be an attempt at hardass american but sometimes just lapses into unhidden british ,1
instead of trying to bust some blondeslrb diggs rrb should be probing why a guy with his talent ended up in a movie this bad ,1
initial strangeness inexorably gives way to rote sentimentality and mystical tenderness becomes narrative expedience ,1
de ayala is required to supply too much of the energy in a film that isoverallfar too staid for its subject matter ,1
dismally dull scifi comedy ,1
theresurely something wrong with a comedy where the only belly laughs come from the selection of outtakes tacked onto the end credits ,1
when one hears harry shearer is going to make his debut as a film directorone would hope for the best,1
the leads we are given here are simply too bland to be interesting ,1
lrb tobackrrb fondness for fancy splitscreenstuttering editing and pompous references to wittgenstein and kirkegaardblends uneasily with the titillating material ,1
adam sandler crazy nights iswasted minutes of sandler as the voiceover hero in columbia picturesperverse idea of an animated holiday movie ,1
essentiallyfatal attractionremade for viewers who were in diapers when the original was released in,1
 this story gets silliernot scarieras it goes along ,1
even a hardened voyeur would require the patience of job to get through this interminableshapeless documentary about the swinging subculture ,1
the filmhero is a bore and his innocence soon becomes a questionable kind of inexcusable dumb innocence ,1
a singularly offputting romantic comedy ,1
this is an exercise not in biography but in hero worship ,1
it all comes down to whether you can tolerate leon barlow ,1
i ca nt ,1
in the spirit of the seasoni assign one bright shining star to roberto benignipinocchiobut i guarantee that no wise men will be following after it ,1
check your brain and your secret agent decoder ring at the door because you do nt want to think too much about whatgoing on ,1
the movie does has some entertainment valuehow much depends on how well you like chris rock ,1
a movie that seems motivated more by a desire to match mortarboards with dead poets society and good will hunting than by its own story ,1
a culture clash comedy only half as clever as it thinks it is ,1
the logic of it all will be greek to anyone not predisposed to the movierude and crude humor ,1
as selfaware movies gowho is cletis tout ,1
is clever enoughthough thin writing proves its undoing ,1
starts out strongly before quickly losing its focuspoint and purpose in a mess of mixed messagesoverblown drama and bruce willis with a scar ,1
 a fascinating curiosity piecefascinatingthat isfor about ten minutes ,1
after that it becomes long and tedious like a classroom play in a college history course ,1
director jay russell weighs down his capricious fairytale with heavy sentiment and lightweight meaning ,1
there are many things that solid acting can do for a moviebut crafting something promising from a mediocre screenplay is not one of them ,1
its screenplay serves as autocritiqueand its clumsiness as its own most damning censure ,1
at timesit actually hurts to watch ,1
nemesis suffers from a paunchy midsectionseveral plodding action sequences and a wickedly undramatic central theme ,1
the jokes are telegraphed so far in advance they must have been lost in the mail ,1
lrb tries rrb to parody a genre thatalready a joke in the united states ,1
the movie is the equivalent of french hiphopwhich also seems to play on a year delay ,1
a beyondlame satireteddy bearspicnic ranks among the most pitiful directing debuts by an esteemed writeractor ,1
i ve never seen lrb a remake rrb do anything as stomachturning as the way adam sandlernew movie rapespillages and incinerates frank capraclassic ,1
hollywoodanswer to an air ball ,1
and people make fun of me for liking showgirls ,1
such a wildly uneven hitandmiss enterpriseyou ca nt help suspecting that it was improvised on a daytoday basis during production ,1
a weird little movie thatamusing enough while you watch itoffering fine acting moments and pungent insights into modern lashowbiz and media subcultures ,1
but it does nt leave you with much ,1
i m convinced i could keep a family of five blindcrippledamish people alive in this situation better than these british soldiers do at keeping themselves kicking ,1
like mike is a slight and uninventive movielike the exalted michael jordan referred to in the titlemany can aspire but none can equal ,1
there is nothing funny in this everyjokehasbeentoldathousandtimesbefore movie ,1
always destined to be measured against anthony asquithacclaimedscreen adaptation ,1
this is standard crime drama fareinstantly forgettable and thoroughly dull ,1
theresome outrageously creative action in the transporterlrb b rrb ut by the time frank parachutes down onto a moving truckitjust another cartoon with an unstoppable superman ,1
one of those basedontruth stories that persuades youwith every scenethat it could never really have happened this way ,1
from its nauseating spinning credits sequence to a very talented but underutilized supporting castbartleby squanders as much as it gives out ,1
yet another genre exercisegangster nois as generic as its title ,1
despite the holes in the story and the somewhat predictable plotmoments of the movie caused me to jump in my chair ,1
therean admirable rigor to jimmyrelentless angerand to the scriptrefusal of a happy endingbut as those monologues stretch on and onyou realize thereno place for this story to go but down ,1
once againthe intelligence of gay audiences has been grossly underestimatedand a meaty plot and welldeveloped characters have been sacrificed for skin and flash that barely fizzle ,1
a lightweightuneven action comedy that freely mingles frenchjapanese and hollywood cultures ,1
such a fine idea for a filmand such a stultifyinglifeless execution ,1
lrb allenrrb best works understand why snobbery is a better satiric target than middleamerica diversions could ever be ,1
this overlong infomercialdue out on video before monthendis tepid and tedious ,1
an ambitiousguiltsuffused melodrama crippled by poor casting ,1
rarely has sex on screen been so aggressively antierotic ,1
a dullinconsistentdishonest female bonding picture ,1
so much about the film is loopy and ludicrousthat it could have been a hoot in a badmovie way if the laborious pacing and endless exposition had been tightened ,1
a disappointment for a movie that should have been the ultimate imax trip ,1
does little to elaborate the conceit of setting this bloodsoaked tragedy of murderous ambition in the era of richard nixon ,1
this sade is hardly a perversedangerous libertine and agitatorwhich would have made for better drama ,1
hejust a sad aristocrat in tattered fineryand the film seems as deflated as he does ,1
the filmneedlessly opaque intro takes its doeeyed crudup out of pre new york and onto a crosscountry road trip of the homeric kind ,1
itas if a bored cage spent the duration of the filmshooting schedule waiting to scream got aids yet,1
in a strange wayegoyan has done too much ,1
heworked too hard on this movie ,1
the film has the throwntogether feel of a summercamp talent showhastily writtenunderrehearsedarbitrarily plotted and filled with crude humor and vulgar innuendo ,1
the last three narcissists left on earth compete for each othersaffections ,1
a clash between the artificial structure of the story and the more contemporarynaturalistic tone of the film ,1
the moviemessages are quite admirablebut the story is just too clichd and too often strains credulity ,1
what we have here is nt a disasterexactlybut a very handsomely produced letdown ,1
the script was reportedly rewritten a dozen timeseithertimes too many or else too few ,1
a shoddy male hip hop fantasy filled with gunsexpensive carslots of naked women and rocawear clothing ,1
to the filmmakersivan is a prince of a fellowbut he comes across as shallow and glib though not meanspiritedand thereno indication that hebeen responsible for putting together any movies of particular value or merit ,1
this is a movie filled with unlikablespiteful idiotswhether or not their friendship is salvaged makes no difference in the least ,1
itas if allenat has stopped challenging himself ,1
scotlandpa is entirely too straightfaced to transcend its clever concept ,1
a movie that the less charitable might describe as a castrated cross between highlander and lolita ,1
not only does leblanc make one spectacularly uglylooking broadbut he appears miserable throughout as he swaggers through his scenes ,1
therelittle to recommend snow dogsunless one considers cliched dialogue and perverse escapism a source of high hilarity ,1
itdeepsixed by a compulsion to catalog every bodily fluids gag in theresomething about mary and devise a parallel clonegag ,1
the film rehashes several old themes and is capped with pointless extremesitinsanely violent and very graphic ,1
sorority boyswhich is as bad at it is crueltakes every potential laugh and stilettostomps the life out of it ,1
here the love scenes all end in someone screaming ,1
maybe therea metaphor herebut figuring it out would nt make trouble every day any better ,1
this is the first film i ve ever seen that had no obvious directing involved ,1
fans of sobadthey regood cinema may find some fun in this jumbled mess ,1
weiss and speck never make a convincing case for the relevance of these two thcentury footnotes ,1
sheridan is painfully bada fourthrate jim carrey who does nt understand the difference between dumb fun and just plain dumb ,1
presents nothing special anduntil the final actnothing overtly disagreeable ,1
the most excruciatingminutes one might sit through this summer that do not involve a dentist drill ,1
was that movie nothing more than a tepid exercise in trotting out a formula that worked five years ago but has since lost its fizz ,1
it goes on for too long and bogs down in a surfeit of characters and unnecessary subplots ,1
itabsolutely amazing how firsttime director kevin donovan managed to find something new to add to the canon of chan ,1
make chanaction sequences boring ,1
youget a sense of good intentions derailed by a failure to seek and strike just the right tone ,1
 in this poor remake of such a well loved classicparker exposes the limitations of his skill and the basic flaws in his vision,1
itthe movie equivalent of a sweaty old guy in a rain coat shopping for cheap porn ,1
the filmfinal hourwhere nearly all the previous unseen material residesis unconvincing soap opera that tornatore was right to cut ,1
the movie does such an excellent job of critiquing itself at every faltering halfstep of its development that criticizing feels more like commiserating ,1
i found it slowpredictable and not very amusing ,1
director yu seems far more interested in grossout humor than in showing us wellthought stunts or a car chase that we have nt seentimes ,1
viewers will need all the luck they can muster just figuring out whowho in this pretentious mess ,1
a pintsizedgoodfellasdesigned to appeal to the younger setitnot a very good movie in any objective sensebut it does mostly hold oneinterest ,1
get out your pooperscoopers ,1
while the material is slightthe movie is better than you might think ,1
itdefinitely not made for kids or their parentsfor that matterand i think even fans of sandlercomic taste may find it uninteresting ,1
sheridan seems terrified of the bookirreverent energyand scotches most of its lanhumorbileand irony ,1
more busy than excitingmore frantic than involvingmore chaotic than entertaining ,1
there are more shots of children smiling for the camera than typical documentary footage which hurts the overall impact of the film ,1
itmakes a better travelogue than movie ,1
itas if solondz had two ideas for two moviescould nt really figure out how to flesh either outso he just sloppedem together here ,1
