sentence,splitset_label
if you adored the full monty so resoundingly that you re dying to see the same old thing in a tired old settingthen this should keep you reasonably entertained ,1
technically and artistically inept ,1
those who are only mildly curiousi fearwill be put to sleep or bewildered by the artsy and often pointless visuals ,1
though tom shadyacfilm kicks off spookily enougharound the halfway mark it takes an abrupt turn into glucose sentimentality and laughable contrivance ,1
a longdull procession of despairset to cello music culled from a minimalist funeral ,1
call me a coldhearted curmudgeon for not being able to enjoy a mindless action moviebut i believe a movie can be mindless without being the peak of all things insipid ,1
death might be a release ,1
 lrb hopkins rrb does nt so much phone in his performance as fax it ,1
noeven thattoo committed ,1
he gets his secretary to fax it,1
sodden and glumeven in those moments where itsupposed to feel funny and light ,1
priggishlethargically paced parable of renewal ,1
a beautifully shot but dull and ankledeepepic,1
even with itsmillion us budgetpinocchio never quite achieves the feel of a fanciful motion picture ,1
this is a thirdperson story nowtold by hollywoodand much more ordinary for it ,1
the filmmakers know how to please the eyebut it is not always the prettiest pictures that tell the best story ,1
writtenflatlyby david kendall and directedbarelyby theresomething about mary cowriter ed decter ,1
the characters are interesting and the relationship between yosuke and saeko is worth watching as it developsbut therenot enough to the story to fill two hours ,1
very well madebut does nt generate a lot of tension ,1
like being invited to a classy dinner soiree and not knowing anyone ,1
you leave the same way you camea few tasty morsels under your beltbut no new friends ,1
itdepressing to see how far herzog has fallen ,1
the question hanging over the time machine is notas the main character suggests what if,1
but rather how can you charge money for this,1
millions of dollars heaped upon a project of such vast proportions need to reap more rewards than spiffy bluescreen technique and stylish weaponry ,1
 freaky friday itnot ,1
perhaps a better celebration of these unfairly dismissed heroes would be a film that is nt this painfully forcedfalse and fabricated ,1
although no pastry is violatedthis nasty comedy pokes fun at the same easy targets as other rowdy raunchfestsfartsboobsunmentionableswithout much success ,1
in this filmaussie david caesar channels the notquitedead career of guy ritchie ,1
maybe you ll be luckyand there ll be a power outage during your screening so you can get your money back ,1
the characterizations and dialogue lack depth or complexitywith the ironic exception of scooter ,1
this film was made by and for those folks who collect the serial killer cards and are fascinated by the mere suggestion of serial killers ,1
for the rest of ussitting through dahmertwo hours amounts to little more than punishment ,1
narc can only remind us of brilliant crime dramas without becoming one itself ,1
somewhere inside the mess that is world travelerthere is a mediocre movie trying to get out ,1
a tedious parable about honesty and good sportsmanship ,1
its strengths and weaknesses play off each other virtually to a standoffwith the unfortunate trump card being the dreary midsection of the film ,1
an artful yet depressing film that makes a melodramatic mountain out of the molehill of a missing bike ,1
the movieultimate pointthat everyone should be themselvesis tritebut the screenwriter and director michel gondry restate it to the point of ridiculousness ,1
a glossy knockoff of a bmovie revenge flick ,1
 expands the horizons of boredom to the point of collapseturning into a black hole of dullnessfrom which no interesting concept can escape ,1
itjust plain boring ,1
sad nonsensethis ,1
but not without cheesy fun factor ,1
one of those decadesspanning historical epics that strives to be intimate and socially encompassing but fails to do justice to either effort in three hours of screen time ,1
really dumb but occasionally really funny ,1
the movie wavers between hallmark card sentimentality and goofylifeaffirming moments straight out of a cellular phone commercial ,1
the directormany dodges and turns add up to little more than a screenful of gamesmanship thatlow on both suspense and payoff ,1
while the transgressive trappings lrb especially the frank sex scenes rrb ensure that the film is never dullrodriguesbeastwithin metaphor is ultimately rather silly and overwroughtmaking the ambiguous ending seem goofy rather than provocative ,1
the satire is unfocusedwhile the story goes nowhere ,1
they threw loads of money at an idea that should ve been so much more even if it was only made for teenage boys and wrestling fans ,1
itmired in a shabby script that piles layer upon layer of action man clich atop wooden dialogue and a shifting tone that falls far short of the peculiarly moral amorality of lrb woorrb best work ,1
reyesdirectorial debut has good things to offerbut ultimately itundone by a sloppy script,1
if you re over have an iq over and have a driverlicenseyou should be able to find better entertainment ,1
the darker elements of misogyny and unprovoked violence suffocate the illumination created by the two daughters and the sparse instances of humor meant to shine through the gloomy film noir veil ,1
 the picturecleverness is ironically muted by the very people who are intended to make it shine ,1
never doeslilostitchreach the emotion or timelessness of disneygreat pastor even that of more recent successes such asmulanortarzan,1
one of those soso films that could have been much better ,1
crossroads feels like a teenybopper ed wood filmreplete with the pubescent scandalous innuendo and the highstrung but flaccid drama ,1
fails to satisfactorily exploit its gender politicsgenre thrills or inherent humor ,1
interview with the assassin is structured less as a documentary and more as a found relicand as such the film has a difficult time shaking its blair witch project realtime roots ,1
cacoyannisvision is far less matureinterpreting the play as a call for pity and sympathy for anachronistic phantasms haunting the imagined glory of their own pasts ,1
it has more in common with a fireworks display than a moviewhich normally is expected to have characters and a storyline ,1
it appears to have been made by people to whom the idea of narrative logic or cohesion is an entirely foreign concept ,1
less a heartfelt appeal for the handicapped than a nice belgian waffle ,1
itnot helpful to listen to extremist namecallingregardless of whether you think kissinger was a calculating fiend or just a slippery selfpromoter ,1
abandon spendsminutes trying figure out whether or not some cocky pseudointellectual kid has intentionally left college or was killed ,1
the only problem is thatby the endno one in the audience or the film seems to really care ,1
no such thing is sort of a minimalist beauty and the beastbut in this case the beast should definitely get top billing ,1
robert john burke as the monster horns in and steals the show ,1
due to stodgysoap operaish dialoguethe rest of the cast comes across as stick figures reading lines from a teleprompter ,1
lrb t rrb he film is never sure to make a clear pointeven if it seeks to rely on an ambiguous presentation ,1
while it may not add up to the sum of its partsholofcenerfilm offers just enough insight to keep it from being simplemindedand the ensemble cast is engaging enough to keep you from shifting in your chair too often ,1
an overwrought taiwanese soaper about three people and their mixedup relationship ,1
nobody seems to have cared much about any aspect of itfrom its cheesy screenplay to the grayish quality of its lighting to its lastminutehaphazard theatrical release ,1
a thoroughly awful moviedumbnarratively chaoticvisually sloppya weird amalgam ofthe thingand a geriatricscream,1
 another example of how sandler is losing his touch ,1
nothing sticksreallyexcept a lingering creepiness one feels from being dragged through a sadsordid universe of gunsdrugsavarice and damaged dreams ,1
what goes on for theminutes ofpanic roomis a battle of witlessness between a notsobright mother and daughter and an even less capable trio of criminals ,1
the plotcontrivances are uncomfortably strained ,1
guilty of the worst sin of attributable to a movie like thisitnot scary in the slightest ,1
schnieder bounces around with limp wristswearing tight tummy tops and hip huggerstwirling his hair on his finger and assuming thatenough to sustain laughs ,1
its simplicity puts an exclamation point on the fact that this is nt something to be taken seriouslybut it also wrecks any chance of the movie rising above similar fare ,1
by the final whistle you re convinced that this mean machine was a decent tv outing that just does nt have big screen magic ,1
to say that this vapid vehicle is downright doltish and uneventful is just as obvious as telling a country skunk that he has severe body odor ,1
a film of emptyfetishistic violence in which murder is casual and fun ,1
pretend ita werewolf itself by avoiding eye contact and walking slowly away ,1
itfunbut ita real howler ,1
some fine actingbut ultimately a movie with no reason for being ,1
itdifficult to feel anything much while watching this moviebeyond mild disturbance or detached pleasure at the acting ,1
a waterlogged version offatal attractionfor the teenybopper seta sadsoggy potboiler that wastes the talents of its attractive young leads ,1
it tells its story in a flat manner and leaves you with the impression that you should have gotten more out of it than you did ,1
sweet gentle jesusdid the screenwriters just do a cutandpaste of every bad actionmovie line in history ,1
itnot the worst comedy of the yearbut it certainly wo nt win any honors ,1
this is for the most part a useless movieeven with a great director at the helm ,1
a loudwitless mess that has none of the charm and little of the intrigue from the tv series ,1
even on its own ludicrous termsthe sum of all fears generates little narrative momentumand invites unflattering comparisons to other installments in the ryan series ,1
though it inspires some lrb outoffield rrb creative thoughtthe film isto its own detrimentmuch more a cinematic collage than a polemical tract ,1
as predictable as the outcome of a globetrottersgenerals gamejuwanna mann is even more ludicrous than you d expect from the guyinadress genreand a personal low for everyone involved ,1
sinks into the usual cafeteria goulash of fart jokesmasturbation jokesand racist japanese jokes ,1
where tom green stages his gags as assaults on americakneejerk moral sanctimonyjackass lacks aspirations of social upheaval ,1
more of an intriguing curiosity than a gripping thriller ,1
the aprilinstalment of the american war for independencecomplete with loads of cgi and bushels of violencebut not a drop of human blood ,1
contains all the substance of a twinkieeasy to swallowbut scarcely nourishing ,1
return to neverland manages to straddle the line between another classic for the company and just another runofthemill disney sequel intended for the home video market ,1
rarely does a film so graceless and devoid of merit as this one come along ,1
ita thin notionrepetitively stretched out to feature lengthawash in selfconsciously flashy camera effectsdroning house music and flatflat dialogue ,1
on a certain base levelblue crush delivers what it promisesjust not well enough to recommend it ,1
the colorful masseur wastes its time on mood rather than riding with the inherent absurdity of ganeshrise up the social ladder ,1
 an incredibly heavyhandedmanipulative dud that feels all too familiar ,1
wimps out by going for that pg ratingso the more graphic violence is mostly offscreen and the sexuality is muted ,1
trapped presents a frightening and compellingwhat if,1
scenario that will give most parents pausethensomething terrible happens ,1
madonna has made herself over so often nowthereapparently nothing left to work withsort of like michael jacksonnose ,1
never having seen the first two films in the seriesi ca nt compare friday after next to thembut nothing would change the fact that what we have here is a load of clams left in the broiling sun for a good three days ,1
the story is lacking any real emotional impactand the plot is both contrived and cliched ,1
a depravedincoherentinstantly disposable piece of hackery ,1
ita bad action movie because thereno rooting interest and the spectacle is grotesque and boring ,1
lrb soderbergh rrb tends to place most of the psychological and philosophical material in italics rather than trust an audienceintelligenceand he creates an overall sense of brusqueness ,1
handsome and sincere but slightly awkward in its combination of entertainment and evangelical boosterism ,1
so aggressively cheery that pollyana would reach for a barf bag ,1
scoobydoo does nt know if it wants to be a retrorefitting exercise in campy recall for older fans or a sillynickelodeonesque kiddie flick ,1
russell lacks the visual panachethe comic touchand perhaps the budget of sommerstitlebout features ,1
highly uneven and inconsistentmargarita happy hour kinda resembles the el cheapo margaritas served within ,1
very stupid and annoying ,1
the sum of all fears pretends to be a serious exploration of nuclear terrorismbut itreally nothing more than warmedover cold war paranoia ,1
a listless and desultory affair ,1
represents the depths to which the girlsbehavingbadly film has fallen ,1
how inept is serving sara ,1
it makes even elizabeth hurley seem graceless and ugly ,1
jampacked with literally bruising jokes ,1
every five minutes or sosomeone gets clocked ,1
wins my vote fortheenemy of cinemaaward ,1
any chekhov is better than no chekhovbut it would be a shame if this was your introduction to one of the greatest plays of the lastyears ,1
helmer hudlin tries to make a hip comedybut his dependence on slapstick defeats the possibility of creating a more darkly edged tome ,1
lazymiserable and smug ,1
this is one of the biggest disappointments of the year ,1
formulahas dulled your senses faster and deeper than any recreational drug on the market ,1
every visual joke is milkedevery setup obvious and lengthyevery punchline predictable ,1
thereno energy ,1
apparently writerdirector attal thought he need only cast himself and his moviestar wife sitting around in their drawers to justify a film ,1
after the setupthe air leaks out of the movieflattening its momentum with about an hour to go ,1
this is a poster moviea mediocre tribute to films like them ,1
at three hours and with very little story or character developmentthere is plenty of room for editingand a much shorter cut surely would have resulted in a smoothermore focused narrative without sacrificing any of the cultural intrigue ,1
a bit too derivative to stand on its own as the psychological thriller it purports to be ,1
a crude teenoriented variation on a theme that the playwright craig lucas explored with infinitely more grace and eloquence in his prelude to a kiss ,1
the filmdarker moments become smoothed over by an overwhelming need to tender inspirational tidingsespecially in the last few cloying moments ,1
if you recognize zeus lrb the dog from snatch rrb it will make you wish you were at home watching that movie instead of in the theater watching this one ,1
this is the kind of movie that you only need to watch for about thirty seconds before you say to yourself ahyeshere we have a badbadbad movie,1
shanghai ghetto should be applauded for finding a new angle on a tireless storybut you might want to think twice before booking passage ,1
plays like a checklist of everything rob reiner and his cast were sending up ,1
theretoo much forced drama in this wildly uneven movieabout a young manbattle with his inescapable past and uncertain future in a very shapable but largely unfulfilling present ,1
itat once laughable and compulsively watchablein its committed dumbness ,1
all the sensualityall the eroticism of a good vampire tale has beenpardon the punsucked out and replaced by goth goofiness ,1
a cross between blow and boyz n the hoodthis movie strives to be morebut does nt quite get there ,1
good performances keep it from being a total rehash ,1
the screenplay is hugely overwrittenwith tons and tons of dialoguemost of it given to children ,1
troll the cult section of your local video store for the real deal ,1
at timesthe movie looks genuinely pretty ,1
your nightmareson the other handwill be anything but ,1
not even felinni would know what to make of this italian freakshow ,1
elmo touts his drug as beingtimes stronger than coke ,1
if you re looking for a tale of brits behaving badlywatch snatch again ,1
it times better than this ,1
itdifficult to conceive of anyone who has reached puberty actually finding the characters in slackers or their antics amusinglet alone funny ,1
despite its promising cast of charactersbig trouble remains a loosely tied series of vignettes which only prove thatzanydoes nt necessarily meanfunny,1
both shrill and soporificand because everything is repeated five or six timesit can seem tiresomely simpleminded ,1
does not go far enough in its humor or stock ideas to stand out as particularly memorable or even all that funny ,1
neither revelatory nor truly edgymerely crassly flamboyant and comedically labored ,1
just about everyone involved here seems to be coasting ,1
there are a few modest laughsbut certainly no thrills ,1
fails so fundamentally on every conventional level that it achieves some kind of goofy grandeur ,1
therea persistent theatrical sentiment and a woozy quality to the manner of the storytellingwhich undercuts the devastatingly telling impact of utter loss personified in the filmsimple title ,1
while howardappreciation of brown and his writing is clearly wellmeaning and sincerethe movie would be impossible to sit through were it not for the supporting cast ,1
a preposterousprurient whodunit ,1
gogirlsright down the reality drain ,1
boasting some of the most poorly staged and lit action in memoryimpostor is as close as you can get to an imitation movie ,1
can be classified as one of thosealternate realitymoviesexcept that it would have worked so much better dealing in only one reality ,1
predictable and cloyingthough brown sugar is so earnest in its yearning for the days before rap went nihilistic that it summons more spirit and bite than your average formulaic romantic quadrangle ,1
 unlikableuninterestingunfunnyand completelyutterly inept ,1
the film is so busy making reference to other films and trying to be other films that it fails to have a heartmind or humor of its own ,1
an imponderably stilted and selfconsciously arty movie ,1
muddledmelodramatic paranormal romance is an alltime low for kevin costner ,1
too clumsy in key momentsto make a big splash ,1
just a bunch of good actors flailing around in a caper thatneither original nor terribly funny ,1
 matrix style massacres erupt throughoutbut the movie has a tougher time balancing its violence with kafkainspired philosophy ,1
at least ita fairly impressive debut from the directorcharles stone iii ,1
it all unfolds predictablyand the adventures that happen along the way seem repetitive and designed to fill timeproviding no real sense of suspense ,1
wanker goths are on the loose ,1
run for your lives ,1
why would anyone cast the magnificent jackie chan in a movie full of stunt doubles and special effects ,1
a gratingemaciated flick ,1
unambitious writing emerges in the movieusing a plot that could have come from an animatedmovie screenwriting textbook ,1
presents a good case while failing to provide a reason for us to care beyond the very basic dictums of human decency ,1
we have poignancy jostling against farcethoughtful dialogue elbowed aside by onelinersand a visual style that incorporates rotoscope animation for no apparent reason exceptmaybethat it looks neat ,1
according to the scriptgrant and bullockcharacters are made for each other ,1
but you d never guess that from the performances ,1
the animation merely serves up a predictablemaudlin story that swipes heavily from bambi and the lion kingyet lacks the emotional resonance of either of those movies ,1
ararat feels like a book report,1
steve oedekerk isalasno woody allen ,1
a lot like the imaginary sport it projects onto the screenloudviolent and mindless ,1
an amalgam of the fugitiveblade runnerand total recallonly without much energy or tension ,1
the acting is amateurishthe cinematography is atrociousthe direction is clumsythe writing is insipid and the violence is at once luridly graphic and laughably unconvincing ,1
shows that jackie chan is getting olderand thatsomething i would rather live in denial about,1
with miscast leadsbanal dialogue and an absurdly overblown climaxkilling me softly belongs firmly in the sobadit good camp ,1
alasthe blackandwhite archival footage of their act showcases pretty mediocre shtick ,1
the slapstick is laboredand the bigger setpieces flat ,1
this is the kind of movie where people who have never picked a lock do so easily after a few tries and become expert fighters after a few weeks ,1
the problem with the mayhem in formulais not that itoffensivebut that itboring ,1
much of the digitally altered footage appears jaggedas if filmed directly from a television monitorwhile the extensive use of stock footage quickly becomes a tiresome clich ,1
the film never rises above a conventionaltwo dimension tale,1
mark wahlbergmay look classy in a shomage pokepie hatbut as a character hedrydrydry ,1
told in scattered fashionthe movie only intermittently lives up to the stories and faces and music of the men who are its subject ,1
the irony is that this filmcast is uniformly superbtheir performances could haveshould havebeen allowed to stand on their own ,1
now i can see why people thought i was too hard onthe mothman prophecies,1
if ever a concept came handed down from the movie gods on a silver platterthis is it ,1
if ever such a dependable concept was botched in executionthis is it ,1
with an unusual protagonist lrb a kiltwearing jackson rrb and subject matterthe improbableformula is somewhat entertainingbut it could have been much stronger ,1
sandra bullockbest dramatic performance to date lrb is rrb almost enough to lift lrb this rrb thrillkill catandmouserabove its paintbynumbers plot ,1
a feelgood movie that does nt give you enough to feel good about ,1
adolescents will be adequately served by the moviesophomoric blend of shenanigans and slapstickalthough the more lasciviousminded might be disappointed in the relative modesty of a movie that sports atopless tutorial service,1
this mistakenidentity picture is so filmculture referential that the final product is a ghost ,1
the picture emerges as a surprisingly anemic disappointment ,1
de niro cries ,1
you ll cry for your money back ,1
slap mei saw this movie ,1
lrb the kidrrb just too bratty for sympathyand as the film grows to its finalehis little changes ring hollow ,1
behind the glitzhollywood is sordid and disgusting ,1
quelle surprise ,1
scherfigwho has had a successful career in tvtackles more than she can handle ,1
just consider what new best friend does not havebeginning with the minor omission of a screenplay ,1
oscar caliber cast does nt live up to material,1
the problems of the people in love in the time of money are hardly specific to their era ,1
they just have problemswhich are neither original nor are presented in convincing way ,1
carrying this waferthin movie on his nimble shoulderschan wades through putrid writingdirection and timing with a smile that says if i stay positivemaybe i can channel one of my greatest picturesdrunken master,1
so putrid it is not worth the price of the match that should be used to burn every print of the film ,1
in the endthe movie bogs down in insignificancesaying nothing about kennedyassassination and revealing nothing about the pathology it pretends to investigate ,1
starts out ballsy and stylish but fails to keep it up and settles into clichs ,1
sometimes makes less sense than the bruckheimeresque american action flicks it emulates ,1
one of those films where the characters inhabit that special annex of hell where adults behave like kidschildren behave like adults and everyone screams at the top of their lungs no matter what the situation ,1
thereonly one way to kill michael myers for goodstop buying tickets to these movies ,1
 rare birdstries to force its quirkiness upon the audience ,1
the movie is about as humorous as watching your favorite pet get buried alive ,1
resident evil is what comes from taking john carpenterghosts of mars and eliminating the beheadings ,1
in other wordsabout as bad a film you re likely to see all year ,1
five screenwriters are credited with the clichladen screenplayit seems as if each watered down the version of the one before ,1
the whole thing comes off like a particularly amateurish episode of bewitched that takes place during spring break ,1
well made but uninvolvingbloodwork is nt a terrible moviejust a stultifyingly obvious onean unrewarding collar for a murder mystery ,1
so we got ten little indians meets friday the th by way of clean and soberfilmed on the set of carpenterthe thing and loaded with actors you re most likely to find on the next inevitable incarnation of the love boat ,1
the movieblatant derivativeness is one reason itso lackluster ,1
kids do nt mind crappy movies as much as adultsprovided therelots of cute animals and clumsy people ,1
 snow dogshas both ,1
italmost as if itan elaborate dare more than a fullblooded film ,1
wobbly senegalese updating ofcarmenwhich is best for the stunning star turn by djeinaba diop gai,1
